{
  "task_id": "task-5EED5AC2",
  "reviewed_at": "2026-04-15T13:28:29Z",
  "decision": "revise",
  "score": 5,
  "reasoning": "The task execution did not meet all the success criteria. Specifically, there was a failure in step 5 due to a missing dependency ('pytest'), which violates the 'no execution issues' rule. Additionally, the documentation file is missing required sections, which violates the 'required sections must exist' rule. These issues must be addressed to meet the task's goals.",
  "criteria_met": [
    "The reviewer uses a rule-based system to approve or return 'revise'",
    "All plan steps are verified as completed before approval"
  ],
  "criteria_failed": [
    "No execution issues are present in the final output",
    "Required sections exist in documentation tasks"
  ],
  "revision_requests": [
    "Resolve the execution issue by installing 'pytest' and ensuring it is available on the PATH. Re-run the failing step to confirm a clean exit code of 0.",
    "Add the missing 'Measurable Improvements' and 'Configuration Reference' sections to 'docs/reviewer_approval_system.md'. Ensure each section contains substantive content."
  ],
  "next_steps": []
}