{
  "task_id": "task-64ED3B8D",
  "reviewed_at": "2026-04-15T14:26:55Z",
  "decision": "approved",
  "score": 9,
  "reasoning": "The implementation meets all the specified success criteria. The executor retries a command once after installing missing dependencies, and a clear error message is returned if the installation fails. The logic is structured to prevent infinite loops, and it applies to all run_command steps. The code is well-documented, explaining the self-healing process clearly.",
  "criteria_met": [
    "The executor retries a command once after installing missing dependencies",
    "A clear error message is returned if dependency installation fails",
    "No infinite loops occur during command retries"
  ],
  "criteria_failed": [],
  "revision_requests": [],
  "next_steps": [
    "Consider adding unit tests to verify the self-healing logic under various scenarios."
  ]
}