{
  "task_id": "task-6BE862AC",
  "reviewed_at": "2026-04-15T14:43:00Z",
  "decision": "revise",
  "score": 5,
  "reasoning": "The task execution failed to meet all success criteria. The initial pytest test did not run due to pytest itself not being recognized, indicating a missing dependency on pytest. The process did not demonstrate the detection and installation of the 'requests' library as intended, since the error was related to pytest not being available. The documentation in PROCESS.md is thorough but does not reflect the actual execution issues encountered.",
  "criteria_met": [
    "The process is documented clearly in Markdown format"
  ],
  "criteria_failed": [
    "The initial pytest test fails due to the missing dependency",
    "The missing dependency is correctly identified and installed",
    "The pytest test passes after installing the dependency"
  ],
  "revision_requests": [
    "Ensure that pytest is installed and available before running the tests.",
    "Demonstrate the failure of the pytest test due to the missing 'requests' dependency, not due to pytest itself.",
    "Correctly identify and install the 'requests' library as the missing dependency, and rerun the test to ensure it passes.",
    "Update the documentation in PROCESS.md to accurately reflect the steps taken and the issues encountered during execution."
  ],
  "next_steps": []
}