{
  "task_id": "task-34BE0BA7",
  "reviewed_at": "2026-04-15T19:12:53Z",
  "decision": "revise",
  "score": 5,
  "reasoning": "The execution partially meets the success criteria. The planner prompt file was located and modified to enforce the use of 'python -m pytest', which satisfies the first two criteria. However, the verification step failed due to an error, and a new plan was not successfully generated to confirm the correct test commands, failing the third criterion.",
  "criteria_met": [
    "The planner prompt file is successfully located and identified",
    "The planner prompt is updated to enforce 'python -m pytest' and forbid 'pytest' alone"
  ],
  "criteria_failed": [
    "A new plan is generated using the updated prompt, and all test commands use 'python -m pytest'"
  ],
  "revision_requests": [
    "Resolve the error encountered in step 3 to successfully generate a new plan.",
    "Ensure the new plan uses 'python -m pytest' for all test commands and verify this by reviewing the generated plan."
  ],
  "next_steps": []
}