{
  "task_id": "task-6C5C989C",
  "reviewed_at": "2026-04-15T12:43:36Z",
  "decision": "approved",
  "score": 9,
  "reasoning": "The task execution successfully updated the reviewer logic to enforce strict production-quality standards. The changes ensure that tasks are only approved if they meet all defined quality criteria, including completeness, clarity, differentiation, and limitations. The reviewer now provides specific revision instructions when a task is incomplete or unclear, and the documentation clearly outlines the new checks and decision logic. The only issue encountered was a failed step unrelated to the core logic changes, which does not impact the overall functionality.",
  "criteria_met": [
    "Reviewer only approves tasks that meet all defined quality standards",
    "Reviewer provides specific revision instructions if a task is incomplete or unclear",
    "Reviewer checks for clear differentiation and limitations in tasks"
  ],
  "criteria_failed": [],
  "revision_requests": [],
  "next_steps": [
    "Consider running additional tests to ensure the robustness of the new logic under various task scenarios."
  ]
}