{
  "task_id": "task-95BFE620",
  "reviewed_at": "2026-04-15T18:35:31Z",
  "decision": "revise",
  "score": 6,
  "reasoning": "The execution result indicates that while the planner module was updated to include validation logic and remove placeholders, the task failed to meet all success criteria due to an error encountered during execution. Specifically, the command 'python -m pytest' failed because the 'pytest' module was not installed, which suggests that the validation logic did not fully prevent non-executable commands from being executed. This indicates a gap in the validation logic or its application.",
  "criteria_met": [
    "No placeholders are present in any run_command steps",
    "Validation logic is implemented to identify non-executable commands"
  ],
  "criteria_failed": [
    "All run_command steps produce shell commands that execute without errors in a local environment",
    "Validation logic successfully identifies and rejects non-executable commands"
  ],
  "revision_requests": [
    "Ensure that the validation logic correctly identifies and rejects commands that cannot be executed due to missing modules, such as 'pytest', before execution.",
    "Verify that the validation logic is applied consistently to all run_command steps to prevent execution failures."
  ],
  "next_steps": []
}