{
  "task_id": "task-6C5A7B4D",
  "reviewed_at": "2026-04-15T18:59:42Z",
  "decision": "revise",
  "score": 6,
  "reasoning": "The task execution shows that the planner has been enhanced with adaptive logic to handle execution failures, and the documentation and test cases reflect these changes. However, the execution result indicates a failure in step 6 due to 'pytest' not being recognized, which suggests that the adaptive logic did not successfully handle this scenario. This failure indicates that the planner may not be adapting plans correctly in all cases, which is a critical part of the task's success criteria.",
  "criteria_met": [
    "The planner maintains its original functionality without regression issues",
    "Identical plans are not generated across revisions in any test cases"
  ],
  "criteria_failed": [
    "The planner successfully adapts plans by modifying or replacing failed steps in at least 90% of test cases"
  ],
  "revision_requests": [
    "Ensure that the planner correctly adapts the plan when 'pytest' is not recognized, by modifying the command to use 'python -m pytest' or installing 'pytest' before execution.",
    "Verify that the adaptive logic is tested and works in practice by ensuring that the test suite passes without manual intervention."
  ],
  "next_steps": []
}