{
  "task_id": "task-1F56C8CA",
  "reviewed_at": "2026-04-15T11:33:26Z",
  "decision": "approved",
  "score": 9,
  "reasoning": "The README has been significantly improved in terms of clarity and structure. It is well-organized with a comprehensive table of contents and logical sections that guide the reader through the system's architecture, setup, usage, and design principles. The document is free of grammatical and spelling errors, meeting the production-quality standard. The original intent and information have been maintained while enhancing readability.",
  "criteria_met": [
    "The README is clearly understandable by a new user",
    "The README follows a logical structure with appropriate headings",
    "The README is free of grammatical and spelling errors"
  ],
  "criteria_failed": [],
  "revision_requests": [],
  "next_steps": [
    "Consider adding visual aids or diagrams to further enhance understanding, especially in the architecture and workflow sections."
  ]
}