{
  "task_id": "task-49D6EBCC",
  "reviewed_at": "2026-04-15T14:54:50Z",
  "decision": "revise",
  "score": 5,
  "reasoning": "The task execution partially meets the success criteria. The planner codebase has been updated to use 'python -m pytest' and 'python -m pip install', which aligns with the task requirements. However, the execution encountered a failure at step 5, indicating that the changes might not be fully compatible with the executor environment. This suggests that the generated plans may not work as intended, failing the third success criterion.",
  "criteria_met": [
    "All test commands in the planner use 'python -m pytest'",
    "All dependency installation steps use 'python -m pip install <package>'"
  ],
  "criteria_failed": [
    "Generated plans are verified to work in the executor environment with these changes"
  ],
  "revision_requests": [
    "Investigate and resolve the failure encountered in step 5 to ensure that the generated plans are compatible with the executor environment.",
    "Verify that the changes do not affect the functionality of existing plans by running additional tests or validations."
  ],
  "next_steps": []
}