{
  "task_id": "task-9B4EDFFC",
  "reviewed_at": "2026-04-15T14:15:24Z",
  "decision": "revise",
  "score": 5,
  "reasoning": "The execution partially meets the success criteria. The code attempts to ensure that pytest is installed and used correctly, but the execution result indicates a failure due to pytest not being found, suggesting the installation logic did not execute as expected. Additionally, while the revision handling logic appears to be implemented correctly, the failure in the test execution step prevents full validation of the task's goals.",
  "criteria_met": [
    "Tasks fail at the configured MAX_REVISIONS limit without exceeding it."
  ],
  "criteria_failed": [
    "Tests run successfully using 'python -m pytest' in the project environment.",
    "Pytest is installed automatically if missing before tests are executed."
  ],
  "revision_requests": [
    "Ensure the 'ensure_pytest_installed' function is correctly invoked before any test execution to prevent ImportError.",
    "Verify that the subprocess call for installing pytest is executed and handles errors appropriately.",
    "Re-run the test execution to confirm that pytest is installed and tests run successfully using 'python -m pytest'."
  ],
  "next_steps": []
}