{
  "task_id": "task-F2D72004",
  "reviewed_at": "2026-04-15T19:05:28Z",
  "decision": "approved",
  "score": 9,
  "reasoning": "The planner prompt has been successfully updated to include a strict rule that mandates the use of 'python -m pytest' for all test commands, explicitly forbidding the use of 'pytest' alone. The prompt clearly states that any non-compliant command must be regenerated until it complies, satisfying the requirement for enforcement at the prompt level. The task execution meets all specified success criteria.",
  "criteria_met": [
    "The planner prompt includes a rule that mandates the use of 'python -m pytest' for all test commands",
    "The planner prompt explicitly forbids the use of 'pytest' alone",
    "The planner is capable of regenerating non-compliant commands until they comply with the rule"
  ],
  "criteria_failed": [],
  "revision_requests": [],
  "next_steps": [
    "Consider testing the planner with various scenarios to ensure the rule is enforced correctly in practice."
  ]
}