{
  "task_id": "task-C3B27332",
  "reviewed_at": "2026-04-15T19:54:08Z",
  "decision": "approved",
  "score": 9,
  "reasoning": "The task execution meets all the specified success criteria. The implementation ensures that all command executions are passed through the `validate_plan` function, and logging is added to confirm validation before execution. The documentation in the README file clearly explains the changes and provides examples of usage and logging output. No execution path bypasses the validation, and the core logic of `validate_plan` remains unaltered.",
  "criteria_met": [
    "All run_command steps are verified to pass through validate_plan",
    "Logs are generated confirming validate_plan execution before each command",
    "No command execution occurs without prior validation"
  ],
  "criteria_failed": [],
  "revision_requests": [],
  "next_steps": [
    "Consider adding unit tests to ensure the validation and logging work as expected in various scenarios."
  ]
}