{
  "task_id": "task-7E7461D5",
  "reviewed_at": "2026-04-15T11:39:19Z",
  "decision": "approved",
  "score": 9,
  "reasoning": "The revised README.md meets all the specified success criteria. It addresses identified weaknesses and gaps by providing comprehensive sections on architecture, setup, usage, workflow, limitations, and more. The document clearly differentiates the project, outlines its limitations, and provides real-world usage clarity. The README.md is well-structured and informative, making it suitable for production-grade documentation.",
  "criteria_met": [
    "All identified weaknesses, gaps, and unclear areas are addressed",
    "All essential sections for production-grade documentation are present",
    "The README.md clearly differentiates the project, outlines its limitations, and provides real-world usage clarity"
  ],
  "criteria_failed": [],
  "revision_requests": [],
  "next_steps": [
    "Consider adding visual aids such as diagrams or flowcharts to further enhance understanding."
  ]
}