{
  "task_id": "task-05E37A11",
  "reviewed_at": "2026-04-15T19:10:15Z",
  "decision": "revise",
  "score": 5,
  "reasoning": "The factorial function and test cases are well-implemented and documented, meeting most of the success criteria. However, the execution failed due to the inability to run pytest, which is a critical part of the task. This prevents verification that all tests pass, which is a key success criterion.",
  "criteria_met": [
    "Factorial function correctly calculates factorial for positive integers",
    "Tests cover edge cases including 0, 1, and negative inputs",
    "Code is documented with comments explaining the logic"
  ],
  "criteria_failed": [
    "All tests pass without errors"
  ],
  "revision_requests": [
    "Ensure pytest is installed and configured correctly in the environment to run the tests successfully.",
    "Verify that all tests pass after resolving the pytest execution issue."
  ],
  "next_steps": []
}