{
  "task_id": "task-TEST0001",
  "reviewed_at": "2026-04-14T20:12:37Z",
  "decision": "approved",
  "score": 9,
  "reasoning": "The README file meets all the specified success criteria. It includes a clear section on system architecture, a detailed workflow description, and step-by-step usage instructions. The document is well-structured and formatted correctly in Markdown. No proprietary or sensitive information is included, adhering to the constraints.",
  "criteria_met": [
    "README includes a clear section on system architecture",
    "README includes a detailed workflow description",
    "README provides step-by-step usage instructions",
    "README is formatted correctly in Markdown"
  ],
  "criteria_failed": [],
  "revision_requests": [],
  "next_steps": [
    "Consider adding diagrams or visual aids to complement the text descriptions for better clarity."
  ]
}