{
  "task_id": "task-153169AE",
  "reviewed_at": "2026-04-15T19:19:59Z",
  "decision": "revise",
  "score": 5,
  "reasoning": "The task execution partially meets the success criteria. While the planner code has been updated to replace placeholder commands with real executable commands, the execution result indicates a failure in step 4 due to an unrecognized command error. This suggests that the real command intended to replace the placeholder is not functioning correctly, which violates the criteria that all commands must be executable.",
  "criteria_met": [
    "No placeholder verification steps remain in the planner",
    "Verification steps that cannot be replaced are removed"
  ],
  "criteria_failed": [
    "All run_command steps in the planner use real executable commands"
  ],
  "revision_requests": [
    "Ensure that the command used in step 4 (`python -m planner --task \"<task_title>\" --dry-run`) is executable in the environment. This may involve verifying the setup instructions or correcting any issues with the command itself.",
    "Address the error encountered in step 4, ensuring that the command is recognized and can be executed without errors."
  ],
  "next_steps": []
}